Page Name,Post Created,Shares,Message,URL
TCD Dearborn News,2024-04-05 14:48:01 EDT,50,"(News & Information Only) the imams and leadership from nearly a dozen mosques across the Greater Detroit area, including Dearborn, Dearborn Heights, Melvindale, Warren, and other locales, have declared the cancellation of all public festivities and celebrations of Eid al-Fitr this year, which is set to fall on Wednesday, April 10, 2024. Eid al-Fitr, a joyous occasion marking the end of the holy month of Ramadan, will be observed differently this year out of deep respect for the innocent victims in the Holy Land, particularly in Gaza. The decision comes in light of the ongoing atrocities and humanitarian crisis unfolding in Gaza. The imams have collectively agreed to dedicate the Eid sermon to addressing the plight of Palestinians in Gaza and the West Bank, against the backdrop of what they describe as an ongoing genocide and the targeting of aid workers. “The grave injustice of our time cannot be overlooked,” said one of the imams, emphasizing the community’s solidarity with the people of Gaza. “Our conscience does not permit us to engage in celebration while we are fully aware of the genocide of our fellow human beings in Gaza and the butchering of those who go to aid them,” the statement continued. As a result, the usual festivities will be forgone, with a focus instead on raising awareness about the dire situation in Gaza. In lieu of traditional Eid celebrations, the imams urge all Islamic Centers to dedicate their donations on the day of Eid to the people of Gaza. (Mosque photo @3andathird)",https://www.facebook.com/100059037075548/posts/980947130549847
USA TODAY,2024-01-27 06:52:02 EST,65,A panel of 17 judges at the International Court of Justice ordered Israel to avert genocide in the Gaza Strip. Here's what the ruling means.,https://www.facebook.com/100053584873398/posts/913812623748225
CBS News,2024-01-26 09:12:47 EST,17,"The United Nations' International Court of Justice on Friday ruled that Israel must take measures to prevent genocide in Gaza, but it stopped short of ordering an immediate cease-fire in Israel's war with Hamas. The ICJ ruled that it has jurisdiction to consider the landmark case brought by South Africa against Israel, and it rejected Israel's request for the case to be dismissed. ICJ's rulings are legally binding and cannot be appealed, but the court has no way of enforcing them. https://cbsn.ws/3vKzFhU:=:https://www.cbsnews.com/news/israel-gaza-genocide-case-at-un-international-court-of-justice-icj/",https://www.facebook.com/100059455603099/posts/781245120534001
Democracy Now!,2024-04-08 15:15:02 EDT,48,Nicaragua Accuses Germany of Enabling Genocide in Gaza at World Court,https://www.facebook.com/100057759681078/posts/851661626769152
Reuters,2024-05-13 22:55:39 EDT,22,The Biden administration says it does not view the killings of Palestinians in Gaza as 'genocide' https://reut.rs/3WCy74X:=:https://www.reuters.com/world/us/white-house-we-do-not-believe-genocide-is-occurring-gaza-2024-05-13/,https://www.facebook.com/100059422245844/posts/952508740073192
AJ+,2024-03-10 08:06:57 EDT,77,"Eurovision is facing boycott calls after organizers allowed Israel to compete at the song contest in May, despite its ongoing attacks in Gaza which have killed over 30,800 Palestinians since October. Israel is also currently on trial for genocide at the World Court. The annual song contest is watched by over 150 million people and describes itself as a “non-political” event. But in 2022, organizers banned Russia from competing after its invasion of Ukraine. Organizers said Russia’s participation would bring the contest into “disrepute.” But despite thousands of artists from participating countries, including host Sweden, calling for Israel to be banned, organizers have confirmed Israel’s participation. Israel’s song was originally rejected for references to the Oct. 7 Hamas attacks. But the song was partially rewritten and the title changed from “October Rain” to “Hurricane.” Palestinians and activists accuse Israel of using the contest as propaganda as its attacks kill scores of Palestinians and render their homes in Gaza uninhabitable.",https://www.facebook.com/100064529598989/posts/799239408903705
Francesca Fiorentini,2023-10-20 19:01:01 EDT,44,"The United States has now vetoed a U.N. resolution condemning violence against all civilians in the Israel-Hamas war. Last week, Israel’s Defense Minister Yoav Gallan ordered a “complete siege” of the Gaza Strip and said “we are fighting human animals and we are acting accordingly,” about the Palestinians they would drop bombs on. Since Oct 7th, the Gaza Health Ministry says nearly 3,500 people have been killed in Gaza and more than 12,000 wounded. In the Israel Defense Force, there’s an open admission of targeting civilians. “It is an entire nation out there that is responsible,” said Israeli President Isaac Herzog on Friday. “It is not true this rhetoric about civilians not being aware, not involved. It’s absolutely not true. They could have risen up. They could have fought against that evil regime which took over Gaza in a coup d’etat.” Meanwhile civilians in Gaza are not only being attack by air but also without water and electricity for much of the day as Israel attempts to starve them out of their land. One child is killed every 15 minutes in the Israeli bombings of Gaza. “We are witnessing a genocide in real time,” a spokesperson for The Defense for Children International – Palestine (DCIP) said. *************************** Independent creators rely on your support to create the content you want! Join this channel to get access to perks: https://www.youtube.com/channel/UCkztf6gttP8D3vrusCrrp4g/join:=:https://www.youtube.com/channel/UCkztf6gttP8D3vrusCrrp4g Become a Patron of The Bitchuation Room: https://www.patreon.com/bitchuationroom Tip the show: Venmo: @TBR-LIVE Cash-App: @TBRLIVE Get your TBR merch: www.bitchuationroom.com:=:https://bitchuationroom.com/ *************************** Thanks to Paige Omek, Alexandra Ornes, and Max Inhoff *************************** Follow The Bitchuation Room on Twitter @BitchuationPod Check Out The Bitchuation Room Podcast iTunes: http://bit.ly/iTunesbitchuation:=:https://podcasts.apple.com/us/podcast/the-bitchuation-room/id1438285775 Google Music: http://bit.ly/GoogleBitchuation:=:https://music.youtube.com/googleplaymusic Stitcher: http://bit.ly/stitcherbitchuation:=:https://www.pandora.com/podcast/the-bitchuation-room/PC:31791 Spotify: http://bit.ly/spotifybitchuation:=:https://open.spotify.com/show/7g3vnBu0C2BzutpJXLCVBe Find Francesca On: Twitter: https://twitter.com/franifio YouTube: The Bitchuation Room’s channel: https://www.youtube.com/franifio:=:https://www.youtube.com/channel/UCkztf6gttP8D3vrusCrrp4g Twitch: https://www.twitch.tv/franifio Facebook: https://www.facebook.com/Franifio Insta: https://www.instagram.com/franifio/",https://www.facebook.com/100044365210269/posts/864712495017583
AJ+,2024-03-17 08:06:50 EDT,71,Palestinian doctor Mousa al-Buhaisi served in Ukraine after Russia’s invasion and is currently saving lives in Gaza. He compares what he saw in Ukraine to the genocide in Gaza.,https://www.facebook.com/100064529598989/posts/803120065182306
Palestinian Youth Movement (PYM)- حركة الشباب الفلسطيني,2023-11-01 19:04:25 EDT,150,"🚨MONTREAL - 100K OUT FOR GAZA🚨 Join the Palestinian Youth Movement Montreal alongside a broad coalition of community, labour, and student organizations on November 4th at 2pm at Place-des-Arts (175 Saint-Catherine St. W) for the National Day of Action! Join us to make our demands clear: 1. An immediate ceasefire 2. Lifting the siege on Gaza 3. An end to Canada's complicity in the genocide On November 4th, our voices will unite with the hundreds of thousands of people who will also be marching in Washington DC at the same time. Let's show the world that we are not just people in solidarity with Palestine, we are a movement that will rise from every corner of the world until all our demands are met. *** 🚨MONTRÉAL - 100K MARCHE POUR GAZA🚨 Joignez-vous au Palestinian Youth Movement Montreal ainsi qu'à une large coalition d'organisations communautaires, syndicales et étudiantes le 4 novembre à 14h à la Place-des-Arts (175 rue Sainte-Catherine Ouest) pour la Journée nationale d'action ! Joignez-vous à nous pour exprimer clairement nos revendications : 1. Un cessez-le-feu immédiat 2. La fin du blocus de Gaza 3. La fin de la complicité canadienne Le 4 novembre, nos voix s'uniront à celles des centaines de milliers de personnes qui défileront à Washington DC au même moment. Montrons au monde que nous ne sommes pas seulement des personnes solidaires de la Palestine, nous sommes un mouvement qui s'élèvera de tous les coins du monde jusqu'à ce que toutes nos demandes soient satisfaites. *** تدعوكم حركة الشباب الفلسطيني إلى جانب تحالف واسع من المنظمات المجتمعية والعمالية والطلابية لمسيرة حاشدة من أجل غزة، وذلك يوم السبت 4 نوفمبر بتمام الساعة 2 مساءً في Place des Arts. لنصرخ بصوتٍ مرتفع بضرورة المطالبة العاجلة لوقف اطلاق النار، ووقف التمويل العسكري لدولة الاحتلال، ورفع الحصار عن ابناء شعبنا!",https://www.facebook.com/100064479708447/posts/716972507128733
AJ+,2024-05-16 10:16:44 EDT,95,FIFA turns a blind eye as Israel commits genocide in Gaza and turns football stadiums into detention centers.,https://www.facebook.com/100064529598989/posts/842374341256878
AJ+,2024-03-29 05:42:41 EDT,44,"Activists painted the Palestinian flag on this 374-step staircase in Liège, Belgium, in solidarity with Gaza amid Israel’s genocide. Artists and activists around the world have taken to public spaces to paint murals, flags and graffiti in support of Palestinian rights.",https://www.facebook.com/100064529598989/posts/811287677698878
The Hill,2024-04-08 23:40:07 EDT,7,"Sen. Elizabeth Warren (D-Mass.) recently suggested international offices could find Israel’s bombardment of Gaza constitutes as genocide in the enclave. The ICJ, the top United Nations judicial body, ruled in January that Israel must do more to protect civilians in the Gaza Strip but did not issue an order demanding a cease-fire in the strip.",https://www.facebook.com/100059352919301/posts/802345648420525
Democracy Now!,2024-03-30 19:39:00 EDT,60,"“What this genocide has done is it has revealed the weaknesses, the political compromises, the moral failings of the United Nations and other international institutions.""",https://www.facebook.com/100057759681078/posts/846479703954011
The Hill,2023-10-25 19:10:08 EDT,8,"Presidential candidate Sen. Tim Scott (R-S.C.) said foreign students protesting at U.S. colleges against Israel amid its war with Hamas in Gaza should be “deported.” “Any time you actually encourage for the genocide, the elimination of an entire race of people, any time you support terrorism and encourage murder, there should be consequences,” Scott said in a Fox News interview.",https://www.facebook.com/100059352919301/posts/713439263977831
Principles NOT Parties,2024-07-06 18:57:41 EDT,100,"King Ahab & Naboth's vineyard An official declaration by Apartheid Israel that it is stealing more land in the Jordan Valley. It is designating land that belonged to Palestinians as ""state property,"" which allows the land to be leased to Zionist Israelis and prevents Christians and Muslims from owning their own land... The size of the area designated is the largest since the (1993) Oslo Accords, and the year 2024 marks a peak seizure of stolen land, said Peace Now, an Israeli human rights organization based in Tel Aviv, that has tracked the growth of illegal Israeli settlements for decades. The group reported that the land would connect settlements in an area along the Jordan border and make a Palestinian state there impossible. Israel could have had peace & security at anytime. There was nothing they needed to negotiate with anyone. They could have withdrawn from the West Bank, East Jerusalem, Golan Heights and the Gaza Strip Prison Camp to allow an independent nation to be established; or extended human & democratic rights to all. Israel gained control over the West Bank, East Jerusalem, Golan Heights, and the Gaza Strip when it attacked its neighbors in 1967. They attacked the United States at the same time. They planned to sink the U.S.S. Liberty & blame it on Egypt. Israel severely damaged the ship, killed 34 of our sailors, and injured 171. The ship didn't sink & Israel's duplicity was found out. Since then, Israel has built settlements throughout the West Bank, where more than 750,000 Israelis trespassers live. These settlements are illegal under international law. About 3 million Palestinians live in the West Bank, some in places administered by the Palestinian Authority. But much of the West Bank is off-limits to the authority despite the Christians and Muslims living there. They are denied basic human rights, water rights, & not allowed to vote for representation in The Knesset - הכנסת. The Israeli government announced that it has stolen more than 23.7 square kilometers of land in the West Bank since the beginning of this year. The newly taken land is in a place where settler violence was displacing communities of Palestinians even before October 7th. The U.S. Department of State found systematic human rights violations by Israel in the West Bank prior to Hamas' prison outbreak on October 7th. Hamas violently seized settlers to trade for thousands of hostages held by Israel; escalating the war Israel began in 1948. State violence is used to expand Israeli control over large areas and diminishes the likelihood of achieving a Palestinian state. Israel's rapid growth in the West Bank shows how influential the settler community is in the government of Benjamin Netanyahu - בנימין נתניהו. Netanyahu boasted many times that Israel's support for Hamas blocked a two-state solution or extending human & democratic rights to all. Israel helped establish, finance & arm Hamas. When Israel turned Gaza into a prison in 2005, they brought in Hamas to run it for them. Hamas was hated by most of the Christian and Muslim refugees imprisoned there. Finance Minister Bezalel Smotrich, who is also a settler, has accelerated the land theft. He has taken new powers to develop settlements and aims to strengthen Israel's control over the land in the ongoing genocide of Christians and Muslims in Palestine. It's heresy in Judaism and Christianity to conflate the modern state of Israel, founded by non-religious Zionists, with the biblical Israel or the New Jerusalem to be established by the Messiah. Israel's founders and all of its Prime Ministers have been secular Zionists; not believers in Judaism. Most ultra-Orthodox Jews, in Israel & abroad are anti-Zionists. That's why they refuse to serve in the Israel Defense Forces committing genocide in the Gaza Ghetto and violent ethnic cleansing in the West Bank. Jewish Voice for Peace Jews Against Genocide Jews for Palestinian Right of Return Breaking the Silence B'Tselem בצלם If Americans Knew IfNotNow Miko Peled Ilan Pappe Naomi Klein Jeffrey Sachs Jill Stein Amy Goodman Albert Einstein Phyllis Bennis Gabor Maté Norman Finkelstein Noam Chomsky Boycott, Divestment and Sanctions (BDS) Movement",https://www.facebook.com/100063908239195/posts/936930568447209
Palestinian Youth Movement (PYM)- حركة الشباب الفلسطيني,2024-02-29 09:05:54 EST,155,"This morning at dawn, as thousands of Palestinians across the Gaza Strip starve due to the Occupation’s genocidal war, Occupation forces decided that food aid should not reach the besieged and starved Palestinians in Gaza City. As massive crowds formed along food aid routes on al-Rashid street in Gaza City, desperately trying to find food, Occupation tanks began firing on civilians; a horrific massacre resulting in at least 100 martyrs and hundreds more wounded. Israeli military vehicles trampled the bodies of the victims, preventing first responders from reaching them. This massacre is but a continuation of the war of annihilation waged against the Palestinians of Gaza who are being left to starve across their besieged land. Even without food, water, or shelter, the Palestinian people in Gaza continue to be targets for the criminal Occupation forces who attempt to compensate for their failures on the battlefield by massacring civilians. The massacres committed against the people of Gaza have clarified to the world that the depravity of Zionism knows no limits, and masses have mobilized across the world in defense of the Palestinian people. The policy of starvation used by the Israeli forces must be condemned in the strongest terms by the world, which has been witnessing the eradication of an entire people over the past four months. Israel would not be able to continue in its genocide against Gaza were it not for the unlimited support and cover offered by Western powers, especially the US, making them directly complicit in these crimes. We reiterate our most urgent demand for a ceasefire and for the provision of food and other aid into Gaza, without it being targeted by blood thirsty Occupation forces. We reiterate that the funders of this genocide must also be held accountable and it is our responsibility to stop the funding and arming of this criminal Occupation that wages war against the men, women, and children of Gaza.",https://www.facebook.com/100064479708447/posts/786000650225918
Democracy Now!,2024-04-18 16:11:01 EDT,46,Journalist Attempts Citizen’s Arrest of EU Leader Ursula von der Leyen for Enabling Gaza Genocide,https://www.facebook.com/100057759681078/posts/857555516179763
Palestinian Youth Movement (PYM)- حركة الشباب الفلسطيني,2024-04-24 00:07:29 EDT,154,"54 years after the National Guard was deployed at Kent State and carried out the heinous massacre of students protesting the war in Vietnam, Columbia University administration is now threatening to bring the National Guard on campus to crush the student protests that are opposing the genocide in Gaza. It is the height of irony that the Columbia University administration officials are echoing the calls of extreme right-wing republicans in Congress to use the US military to suppress the student movement at Columbia. The efforts to intimidate, scare, and break the will of students demanding justice will not succeed. People all over the United States and indeed around the world salute the heroic stand taken by Columbia students and students at college campuses throughout the United States that are demanding liberation for the Palestinian people.",https://www.facebook.com/100064479708447/posts/818796546946328
CBS News,2024-05-24 10:19:42 EDT,6,"The International Court of Justice has ordered Israel to halt its military offensive in the southern Gaza city of Rafah, and to take measures to ensure U.N. investigators have unimpeded access to Gaza to investigate allegations of genocide.",https://www.facebook.com/100059455603099/posts/849849280340251
The Wall Street Journal,2024-01-26 08:04:11 EST,10,A U.N. court ordered Israel to ensure that it doesn't violate the Genocide Convention but stopped short of calling for a cease-fire in Gaza.,https://www.facebook.com/100059298201442/posts/769155605071039
AJ+,2024-05-10 01:20:28 EDT,83,Israeli settlers are already renaming towns that they want to move to in Gaza. But settlements aren’t something the Israeli government is prioritizing as the Gaza genocide continues. +972 Magazine editor Amjad Iraqi explains:,https://www.facebook.com/100064529598989/posts/837923371701975
AJ+,2024-05-19 03:28:57 EDT,77,Israeli settlers are already renaming towns that they want to move to in Gaza. But settlements aren’t something the Israeli government is prioritizing as the Gaza genocide continues. +972 Magazine editor Amjad Iraqi explains:,https://www.facebook.com/100064529598989/posts/843289817831997
AJ+,2024-03-04 08:11:39 EST,74,Palestinian doctor Mousa al-Buhaisi served in Ukraine after Russia’s invasion and is currently saving lives in Gaza. He compares what he saw in Ukraine to the genocide in Gaza.,https://www.facebook.com/100064529598989/posts/795139122647067
Palestinian Youth Movement (PYM)- حركة الشباب الفلسطيني,2024-04-05 23:29:31 EDT,156,"One of many unreported massacres that took place in North Gaza, this scene is from the Al Daraj neighborhood. Resident survivors wrote the names of some of the martyrs on the large concrete hull of a fallen apartment building. Over 120 Palestinians were killed in the Al Daraj massacre, which has received little to no international media coverage. Buried under the few visible stories that make it out of Gaza are thousands upon thousands of stories that remain unknown and undocumented to the outside world. This is the landscape of genocide, whose scale and magnitude are themselves an attempt to wipe out the memory of the Palestinian people and nation. But we will never forget, just as we will never forgive. To Gaza we will return, and every inch of its soil we will rebuild. Glory to every martyr. Palestine will be free.",https://www.facebook.com/100064479708447/posts/807803024712347
AJ+,2024-03-12 00:13:24 EDT,76,Palestinian doctor Mousa al-Buhaisi served in Ukraine after Russia’s invasion and is currently saving lives in Gaza. He compares what he saw in Ukraine to the genocide in Gaza.,https://www.facebook.com/100064529598989/posts/800844245409888
BreakThrough News,2024-01-19 12:54:39 EST,77,"“I will not be voting for someone committing genocide.” Young people are turning their backs on Biden and looking for other options. BT spoke to voters at the March For Gaza in D.C., which was attended by three different independent presidential candidates.",https://www.facebook.com/100063750150699/posts/883730803761917
Palestinian Youth Movement (PYM)- حركة الشباب الفلسطيني,2024-01-06 10:01:25 EST,152,"Former US vice President Mike Pence signs artillery shells before they are launched toward Lebanon. The imperialist violence of the Zionist occupation is made, shipped, and signed by the USA with the open blessing of highest-ranking American politicians. While US politicians claim they are unable to stop Israel‘s genocide in Gaza, they continue to endorse everything that makes this image possible. In reality, Israel gets away with mass killing and land theft because of, and not in spite of, the United States. Our role in the heart of US empire is to confront and defeat the political machinery that is making the genocide possible. Until the final hour of victory over Zionism, the struggle continues.",https://www.facebook.com/100064479708447/posts/753806473445336
Palestinian Youth Movement (PYM)- حركة الشباب الفلسطيني,2023-11-11 20:37:35 EST,108,"The global movement for a Free Palestine is growing. Millions are demonstrating and organizing major marches in solidarity. Our demands for an immediate ceasefire, cutting all aid to Israel, and lifting the siege on Gaza have broader support than ever. NOW is the time for our mobilizations to grow in size, frequency, and focus; building a political climate that makes Israel's business of genocide unsustainable. On November 17, we will continue to build on the global momentum and #ShutItDown4Palestine once again. Visit shutitdown4palestine.org to register your action!",https://www.facebook.com/100064479708447/posts/722167973275853
Yahoo News,2024-06-26 09:05:05 EDT,15,"Progressive New York Rep. Jamaal Bowman is the first member of the ""squad"" to lose a House seat. A pro-Israel group spent nearly $15 million to unseat him after he repeatedly accused Israel of genocide and called for a ceasefire in the Israel-Hamas war.",https://www.facebook.com/100059270842861/posts/864738365511850
Democracy Now!,2024-02-19 14:52:00 EST,56,Protest Actions Against Israel’s Genocide Continue Around the World,https://www.facebook.com/100057759681078/posts/824372559498059
AJ+,2024-03-02 23:07:04 EST,71,Why can’t the World Court stop Israel’s genocide in Gaza?,https://www.facebook.com/100064529598989/posts/795137145980598
Democracy Now!,2023-10-19 16:21:01 EDT,52,Protests from The Hague to Cape Town Condemn Israeli “Genocide” in Gaza,https://www.facebook.com/100057759681078/posts/756050889663560
BreakThrough News,2023-12-19 15:30:14 EST,76,"""They are all unsurprising conspirators in our people's genocide: Chuck Schumer, Ritchie Torres, Cory Booker..."" Protesters demanding a lasting ceasefire in Gaza call out US politicians for their complicity in Israel's war crimes, vowing to withhold their votes in 2024.",https://www.facebook.com/100063750150699/posts/861207799347551
CBS News,2023-10-12 12:00:04 EDT,8,"A Gazan college student tells CBS News that Israel's war with Hamas is ""not even an attack anymore,"" calling the retaliation ""genocide.""",https://www.facebook.com/100059455603099/posts/724194752905705
Democracy Now!,2024-03-07 14:24:01 EST,28,"Activists in D.C. Line Israeli Embassy with Palestinian Flags, Banners Condemning Gaza Genocide",https://www.facebook.com/100057759681078/posts/833462465255735
AJ+,2024-03-07 10:00:46 EST,79,Palestinian doctor Mousa al-Buhaisi served in Ukraine after Russia’s invasion and is currently saving lives in Gaza. He compares what he saw in Ukraine to the genocide in Gaza.,https://www.facebook.com/100064529598989/posts/797900559037590
