Page Name,Post Created,Shares,Message,URL
CNN,2024-04-26 10:01:09 EDT,26,"The demands from the progressive flank of the president’s own party come as protests over the humanitarian crisis in Gaza grow in number and intensity, most notably on college campuses, where protesters have decried the stance of “Genocide Joe.”",https://www.facebook.com/100059479812265/posts/819091120083541
The New York Times,2024-04-09 00:25:05 EDT,34,Nicaragua argued in a new case before the International Court of Justice on Monday that Germany is facilitating the commission of genocide in Gaza and violating the Genocide Convention by providing Israel with military and financial aid.,https://www.facebook.com/100059174186752/posts/812124177436714
The Daily Signal,2024-06-25 21:49:02 EDT,50,"BREAKING: Socialist New York Rep. Jamaal Bowman lost in a Democratic primary in New York’s 16th Congressional District on Tuesday to county executive George Latimer. Bowman is a member of “the Squad,” an informal group of far-Left Democrat House members. He was endorsed by the Democratic Socialists of America. Fellow Squad member Rep. Alexandria Ocasio-Cortez, D-N.Y., appeared at a rally with him in New York on Saturday. Bowman’s challenger entered the primary in part due to Bowman’s opposition to Israel and controversial statements he’s made about Israel’s war in Gaza. The New York congressman has been critical of Israel, even after the Hamas terrorist attack on Oct. 7. He has accused Israel of committing a genocide against Palestinians in Gaza. At a political rally last November, Bowman questioned whether Hamas terrorists actually raped women or killed babies. “There was propaganda used in the beginning of the siege,” Bowman said Nov. 17 at a pro-Palestinian rally, according to a TikTok video reported on by Politico. “There’s still no evidence of beheaded babies or raped women. But they still keep using that lie [for] propaganda.” After initially refusing to address those comments, Bowman reversed himself and condemned the rapes committed by Hamas. In the weeks and days just before the primary vote, Bowman began to change his stance on the Israel-Palestine issue and apologized for the remarks he made about Hamas not committing rape. “Immediately, when the U.N. provided additional evidence, I voted to condemn the sexual violence,” Bowman said a week before the election, according to the Hill. “I apologize for my comments, and now, we’re continuing to do the work to fight sexual violence and domestic violence in all its forms.” Bowman has had other contentious moments and scandals during his time in office. He was censured by Congress following an incident in which he pulled a fire alarm in a congressional office building just before a House vote in late September. The fire alarm nearly delayed a vote on a continuing resolution that, if not passed, would have shut down part of the government. Bowman said he pulled the alarm by mistake and that he thought the lever was a method to open the door and exit the building.",https://www.facebook.com/100070075128715/posts/762586036087227
AJ+,2024-05-12 22:28:28 EDT,167,Israel’s war on Gaza is the deadliest conflict for journalists on record. Dena Takruri talks to Al Jazeera English’s Gaza correspondent Tareq Abu Azzoum about what it’s been like to report nonstop from Gaza since the start of the genocide.,https://www.facebook.com/100064529598989/posts/838596568301322
AJ+,2024-02-27 17:44:37 EST,327,"Major news outlets are being called out for initially omitting the reason why Aaron Bushnell fatally lit himself on fire. Some coverage didn’t mention that he called it “an extreme act of protest” or that his final words were “free Palestine.” Bushnell, who later died from his injuries, also said on his livestream that he would “no longer be complicit in genocide,” despite some coverage initially failing to report the act was a protest at all. Although many reports have been updated, some had said that Bushnell’s reasons for self-immolating were unknown. ⁣ ⁣ Aaron Bushnell was an active-duty member of the Air Force. The Biden administration has deployed the Air Force to help Israel carry out operations in Gaza since at least early November.⁣ ⁣ UN experts have said in a statement that countries that send arms or military intelligence when there’s a risk they could be used to violate humanitarian law could be complicit in genocide. ⁣",https://www.facebook.com/100064529598989/posts/793366919490954
AJ+,2024-04-15 02:24:24 EDT,121,"“There is no point in recognizing the state of Palestine if we do not stop Netanyahu, if we do not prevent a genocide.” Spanish politician Ione Belarra calls out Spain’s inaction on Gaza.",https://www.facebook.com/100064529598989/posts/820957956731850
AJ+,2024-03-19 19:32:30 EDT,133,"Activists painted the Palestinian flag on this 374-step staircase in Liège, Belgium, in solidarity with Gaza amid Israel’s genocide. Artists and activists around the world have taken to public spaces to paint murals, flags and graffiti in support of Palestinian rights.",https://www.facebook.com/100064529598989/posts/805519954942317
Reuters,2024-06-09 07:17:51 EDT,56,"Hundreds of protesters lay down outside Guggenheim Museum Bilbao to mimic casualties in Gaza, accusing Israel of carrying out genocide",https://www.facebook.com/100059422245844/posts/970453021612097
Reuters,2024-05-30 23:00:04 EDT,57,A New York City hospital fired a Palestinian American Muslim nurse after she called Israel's war in Gaza a ‘genocide’ during an acceptance speech for an award for her work with bereaved mothers who lost their children during pregnancy and childbirth ,https://www.facebook.com/100059422245844/posts/964490472208352
Sean Hannity,2024-04-09 12:01:32 EDT,70,"NO EVIDENCE OF GENOCIDE: Austin Confirms U.S. Intelligence Has No Evidence Israel Committing Genocide; Report AUSTIN: “We don’t have any evidence of genocide being [committed].""",https://www.facebook.com/100047112765345/posts/993112435602506
AJ+,2024-03-30 15:04:38 EDT,237,"These videos of possible war crimes in Gaza could amount to evidence of genocide and crimes against humanity, according to an expert in international humanitarian law.",https://www.facebook.com/100064529598989/posts/811668790994100
AJ+,2024-04-13 08:08:26 EDT,132,"“There is no point in recognizing the state of Palestine if we do not stop Netanyahu, if we do not prevent a genocide.” Spanish politician Ione Belarra calls out Spain’s inaction on Gaza.",https://www.facebook.com/100064529598989/posts/820955100065469
CNN,2024-01-26 22:16:22 EST,57,"The UN’s top court ordered Israel to prevent genocide against Palestinians in Gaza, but stopped short of calling for Israel to suspend its military campaign in the war-torn enclave, as South Africa had requested. https://cnn.it/3OlmnPw:=:https://www.cnn.com/2024/01/26/middleeast/israel-genocide-case-icj-hague-ruling-south-africa-intl/index.html",https://www.facebook.com/100059479812265/posts/768666455126008
NEWSMAX,2024-04-10 02:00:04 EDT,40,Defense Secretary Lloyd Austin said there was no evidence Israel has committed genocide against Palestinians during the Hamas war in Gaza. MORE: https://bit.ly/49tzwO7:=:https://www.newsmax.com/us/defense-secretary-lloyd-austin/2024/04/09/id/1160314/,https://www.facebook.com/100064878334770/posts/840449208127683
Dan Crenshaw,2024-05-19 14:39:36 EDT,206,"I’ve been yelled at by countless people over the last few months demanding that I stop supporting the “genocide” against Gaza. I can’t express how exhausting it is to be in modern politics, constantly indundated by shallow talking points and half-baked analysis of literally anything. Our national discussions have become 4th grade level reality TV instead of the serious and nuanced debate of complex issues that our people deserve. In this case, I only see one side who would commit true genocide if they could. Hamas. And who supports Hamas? A large portion of Gazans and Palestinians generally. This is one of many genocidal clauses found in the Hamas official charter: “The Day of Judgment will not come about until Moslems fight Jews and kill them. Then, the Jews will hide behind rocks and trees, and the rocks and trees will cry out: 'O Moslem, there is a Jew hiding behind me, come and kill him.’” (Article 7). My heart breaks for innocent children raised in Gaza by monsters who have created a war and used them as shields for their “jihad.” It’s horrible and disgusting. But there is no question as to where the fault lies: with Hamas and their many, many supporters.",https://www.facebook.com/100044219929935/posts/1019922252825096
AJ+,2024-05-24 09:50:47 EDT,254,"The International Court of Justice (ICJ) has ordered Israel to immediately halt its offensive on Rafah, where its attacks have displaced or trapped over 900,000 Palestinians. It also reaffirmed its previous measures that Israel must take to prevent genocide in Gaza. ⁣ ⁣ The new measures were requested by South Africa, which has put Israel on trial for genocide in Gaza. South Africa says the court’s previous provisional measures demanding Israel take steps to protect Palestinians from genocide – including allowing more aid, preventing incitement of genocide and preventing mass killing – were “not effective.” ⁣ ⁣ Since that ruling, Israel has launched a ground offensive on Rafah and closed the city’s crossing with Egypt, effectively blocking aid from entering. Over 900,000 Palestinians have been displaced in two weeks. In northern Gaza, the UN says Palestinians are already in full-blown famine. ⁣ ⁣ Arguing for new measures, lawyers for South Africa said the Israeli offensive on Rafah – where about half of Gaza’s population was forcibly displaced to – is “the last step in the destruction of Gaza and its Palestinian people.” ⁣ ⁣ Israel’s attacks in Gaza have killed over 35,700 Palestinians since October, including more than 15,000 children. ⁣ ⁣ Israel has repeatedly denied accusations of genocide and said “no power on Earth” would stop its attacks on Gaza. In March, Israel ignored a UN Security Council vote demanding an immediate ceasefire during the last two weeks of Ramadan. ⁣",https://www.facebook.com/100064529598989/posts/847679394059706
Bill O'Reilly,2023-11-30 19:01:09 EST,29,I'm scrutinizing the widespread accusations that Israel is guilty of 'genocide' and 'ethnic cleansing' in Gaza.,https://www.facebook.com/100044608321567/posts/896279248535678
AJ+,2024-05-30 16:47:58 EDT,282,"The world turned its eyes to the city of Rafah in southern Gaza after Israeli strikes on tents burned Palestinians alive. On May 26, displaced Palestinians who were sheltering in their tents in an area designated by Israel awoke to scenes of terror. Israeli bombardment started fires that ripped through their tents and trapped Palestinians under the flames with no escape. The attack killed at least 45 people, including children, and injured more than 200 others. Devastating scenes shocked the world and images of the charred bodies of Palestinians and the body of a decapitated Palestinian child turned attention back to Gaza, with #AllEyesOnRafah. Investigations by CNN and The New York Times have found that Israel dropped U.S.-made bombs on Palestinians in the May 26 attack. Despite orders from the International Court of Justice to stop its invasion and attacks on Rafah, Israeli tanks rolled further into the center of the city. On May 28, displaced Palestinians faced another deadly Israeli attack on a different tent camp. At least 21 Palestinians were killed in the Israeli attack on the Israel-designated “safe zone.” After invading Rafah in May, Israeli forces shut down the city’s border crossing with Egypt where vital humanitarian aid entered Gaza. Israeli attacks have collapsed Gaza’s hospitals and healthcare system, and Palestinians are trapped, with nowhere else to go. In response to the Rafah tent attacks, thousands of people around the world took to the streets once again to demand their governments cut ties with Israel amid the genocide in Gaza. Here’s a list of some people to follow for updates on what’s happening inside Gaza.",https://www.facebook.com/100064529598989/posts/851636353664010
AJ+,2024-04-28 22:07:13 EDT,276,"Pro-Palestinian college students across the U.S. have become the center of media attention, but they want people to remember what they’re protesting: Israel’s genocide in Gaza.",https://www.facebook.com/100064529598989/posts/829623809198598
AJ+,2024-03-04 18:10:57 EST,187,"Nicaragua is taking Germany to the International Court of Justice for its involvement in Israel’s genocide in Gaza. Germany is one of the largest arms exporters to the Israeli military and suspended its funding to the UN Relief and Works Agency, for Palestinian refugees, amid Israel’s war on Gaza. In its filing, Nicaragua stated that Germany is violating international law, citing the 1948 Genocide Convention. The Genocide Convention was adopted three years after WWII, as a response to atrocities like the Holocaust.",https://www.facebook.com/100064529598989/posts/796878549139791
AJ+,2024-05-27 18:20:28 EDT,207,"Thousands of students have been arrested around the world for protesting Israel’s genocide in Gaza. Following the legacies of previous anti-war and anti-apartheid student movements, students globally have been calling for their schools to boycott Israel. ⁣ ⁣ Some have successfully negotiated with their universities to divest from Israel. Here’s a list of schools that have reached agreements with student protesters. ⁣",https://www.facebook.com/100064529598989/posts/849736730520639
ABC News,2024-03-29 15:02:10 EDT,44,"Former Pres. Obama and Clinton joined Pres. Biden for a star-studded fundraiser on Thursday in New York City, which raked in over $26 million for Biden's re-election, his campaign said. But protesters angry with Pres. Biden's handling of Gaza amid the Israel-Hamas war heckled Biden supporters outside of the star-studded event. The three presidents' armchair conversation also saw at least six interruptions from pro-Palestine protesters, with most urging a cease-fire in Gaza and accusing his administration of aiding genocide. https://abcnews.visitlink.me/3V9ble:=:https://abcnews.go.com/Politics/biden-fundraiser-obama-clinton-sees-jokes-protests-war/story?id=108640851",https://www.facebook.com/100059306690876/posts/814519037201645
AJ+,2024-02-08 13:04:01 EST,231,"Thousands of Jewish Americans risked arrest by blocking Pres. Joe Biden’s motorcade in New York City in support of a ceasefire in Gaza. ⁣ ⁣ Joe Biden has been nicknamed “Genocide Joe” for his unwavering support of Israel by offering unrestricted access to U.S. weapons. ⁣ ⁣ Since Oct. 7, at least 27,800 Palestinians have been killed in Israel’s war on Gaza. ⁣",https://www.facebook.com/100064529598989/posts/781723720655274
ABC News,2024-04-29 16:19:04 EDT,50,"LATEST: Israeli leaders have expressed concern over possible arrest warrants that may be issued by the International Criminal Court. The warrants come against key officials, including Prime Minister Netanyahu, an Israeli official told ABC News. The ICC can charge individuals with war crimes, crimes against humanity and genocide under its powers. Read more on the Israel-Hamas conflict: ",https://www.facebook.com/100059306690876/posts/834045745248974
AJ+,2024-02-22 07:30:59 EST,191,Why can’t the World Court stop Israel’s genocide in Gaza?,https://www.facebook.com/100064529598989/posts/789997439827902
AJ+,2024-01-26 14:27:50 EST,267,The ICJ has ruled that Israel must cease any acts that may constitute genocide in Gaza. Here’s a real-time reaction by Palestinian human rights attorney Noura Erakat.,https://www.facebook.com/100064529598989/posts/773379988156314
Mondoweiss,2023-10-26 18:01:56 EDT,360,"This is a list of the 7,028 Palestinians killed thus far in Israel's bombardment on the Gaza Strip that began October 7th. US President Joe Biden and his administration are doing everything they can to cast doubt on the death toll being reported by the Palestinian Health Ministry. This was the ministry's response: the names, aged, and ID numbers of all the victims. So far. #StopTheGenocide #CeasefireNow #EndTheOccupation #Palestine #Gaza #CeasefireNOW #Israel #occupation #apartheid #colonization #settlements #WestBank #GazaStrip #IDF #IsraelDefenseForce #MiddleEast #HumanRights #InternationalLaw #arrests #violence #illegal #FreePalestine",https://www.facebook.com/100064062786653/posts/731448585667228
AJ+,2024-05-15 19:43:14 EDT,275,This 92-year-old Nakba survivor says the genocide in Gaza today is “history repeating itself.” Dawud Assad survived one of the Nakba’s deadliest massacres in Deir Yassin in April 1948.,https://www.facebook.com/100064529598989/posts/841920787968900
Reuters,2024-01-09 03:40:04 EST,30,Israeli President Isaac Herzog said that ‘there is nothing more atrocious and preposterous’ than a lawsuit filed in the International Court of Justice accusing Israel of genocide against Palestinians in its Gaza offensive ,https://www.facebook.com/100059422245844/posts/869846615006072
USA TODAY,2024-03-10 21:29:24 EDT,111,"Just about a block from the red carpet in Hollywood, protesters rallied for a Gaza cease-fire, waved Palestinian flags and blocked traffic near the Dolby Theatre, the site of the Academy Awards. “No red carpet during genocide,” read one sign among dozens speaking out about the Israel-Hamas war: https://www.usatoday.com/picture-gallery/news/nation/2024/03/10/protesters-rally-for-a-gaza-cease-fire-near-academy-awards/72926248007/ 📸: David Sprague",https://www.facebook.com/100053584873398/posts/939823864480434
Reuters,2024-02-19 09:28:08 EST,24,"Brazilian President Luiz Inacio Lula da Silva is not welcome in Israel until he takes back comments likening the war against Hamas militants in Gaza to the Nazi genocide during World War Two, the Israeli foreign minister said ",https://www.facebook.com/100059422245844/posts/897371085586958
BreakThrough News,2023-11-13 18:17:21 EST,207,"Texas organizers estimate that 50,000 people took part in a statewide action for Palestine, the largest since Israel's genocide in Gaza began.",https://www.facebook.com/100063750150699/posts/836227421845589
HuffPost,2024-03-23 19:40:18 EDT,29,"“If you want to know what an unfolding genocide looks like, open your eyes,” Ocasio-Cortez said in a speech on the House floor.",https://www.facebook.com/100059215554772/posts/799604695356708
AJ+,2024-03-09 16:23:07 EST,145,“I will not be eating blood dates.” Muslim TikTokers are calling for a boycott of Israeli dates during Ramadan amid Israel’s genocide in Gaza.,https://www.facebook.com/100064529598989/posts/799202715574041
AJ+,2024-04-23 10:13:13 EDT,273,"Is the U.S. controlled by Israel? Is President Joe Biden helplessly beholden to the whims of Benjamin Netanyahu? In this episode of Backspace, Sana Saeed breaks down the media coverage erasing the U.S. government and Joe Biden’s role in the Gaza genocide.",https://www.facebook.com/100064529598989/posts/827462852748027
The New York Times,2024-01-12 14:40:34 EST,37,"Watch as Israel, a state founded in the aftermath of a genocide against the Jewish people, defended itself against accusations of perpetrating genocide against the Palestinians in Gaza before the International Court of Justice on Friday. https://nyti.ms/3HgckXV:=:https://www.nytimes.com/live/2024/01/11/world/israel-hamas-houthi-yemen-news/israel-presents-its-defense-against-claims-of-genocide-in-gaza",https://www.facebook.com/100059174186752/posts/762319489083850
Breitbart,2024-05-12 20:29:43 EDT,73,"Michael Rapaport: ""The UN has halved the estimated number of women and children killed in Gaza, according to data published earlier this month. On May 6, the UN published data indicating 9,500 women and 14,500 children were killed in Gaza. Then, on May 8, the UN revised and dropped the numbers to 4,959 women and 7,797 children. The UN has admitted that it has not been able to independently verify casualty figures because the numbers come from HAMAS, aka the Ministry of Health. They suck & lie about everything. There’s NO GENOCIDE. Liars, all of you suggesting there’s a genocide, are irresponsible & inciting towards ISRAELIS, JEWS & ALL SUPPORTERS OF JEWS & ISRAEL!""",https://www.facebook.com/100059642974022/posts/852022040129221
Breitbart,2024-05-02 15:53:19 EDT,45,Colombian far-left President Gustavo Petro announced on Wednesday that he would cut diplomatic relations with Israel on Thursday over its “genocide” in Gaza.,https://www.facebook.com/100059642974022/posts/845825444082214
AJ+,2024-01-11 18:31:09 EST,264,"On the eve of the genocide hearing at The Hague, the Israeli army killed at least 147 Palestinians in Gaza.",https://www.facebook.com/100064529598989/posts/764040879090225
AJ+,2024-03-15 23:34:49 EDT,148,A new campaign called No Tax for Genocide wants to hold the British government accountable for its support of Israel’s war on Gaza – by mobilizing the masses to withhold their taxes.,https://www.facebook.com/100064529598989/posts/803115971849382
AJ+,2024-04-09 20:06:54 EDT,119,Nicaragua says that Germany is “directly profiting” from genocide in Gaza by supplying weapons to Israel.,https://www.facebook.com/100064529598989/posts/818991966928449
Democracy Now!,2023-11-10 11:42:01 EST,99,"Three Palestinian rights groups have filed a lawsuit with the ICC, urging it to investigate Israel for the crimes of genocide and apartheid.",https://www.facebook.com/100057759681078/posts/767509718517677
AJ+,2024-02-09 18:26:44 EST,130,Brown University students have led an 8-day hunger strike urging the university to divest from “genocide in Gaza.”,https://www.facebook.com/100064529598989/posts/782562147238098
AJ+,2024-02-18 21:23:38 EST,152,Why can’t the World Court stop Israel’s genocide in Gaza?,https://www.facebook.com/100064529598989/posts/786999723461007
New York Post,2024-03-05 09:36:44 EST,68,Protesters demanded that Ocasio-Cortez call Israel’s military actions in Gaza a “genocide.”,https://www.facebook.com/100059460163041/posts/813611747297490
AJ+,2023-12-31 06:03:34 EST,183,Some experts say genocide is unfolding in Gaza. Let's unpack what constitutes genocide and if Israel is guilty of it.,https://www.facebook.com/100064529598989/posts/756205473207099
Palestinian Youth Movement (PYM)- حركة الشباب الفلسطيني,2024-04-24 01:24:41 EDT,254,"It’s past midnight, and turnout of students and faculty has filled the entire plaza of Columbia University. Students are continuing to demand that Columbia disclose and divest from all its ties to Israel. An end to US complicity in the genocide of Gaza remains students’ focus, they insist, despite media attempts to divert attention to marginal issues like student safety or free speech. In the past hour, students have begun dividing themselves into group formations to block NYPD movement into the liberation encampment zone. This remarkable show of people power from students has caused the university administration to postpone their midnight deadline to make a decision on “alternative options” to clear out the encampment to 8:00 AM. Students have said they will not be moved, even as the sound of helicopters is heard overhead. Stay tuned for updates. 📸 Photo: @saramwahedi",https://www.facebook.com/100064479708447/posts/818825893610060
AJ+,2024-05-08 11:40:35 EDT,257,Israeli settlers are already renaming towns that they want to move to in Gaza. But settlements aren’t something the Israeli government is prioritizing as the Gaza genocide continues. +972 Magazine editor Amjad Iraqi explains:,https://www.facebook.com/100064529598989/posts/837180005109645
AJ+,2024-04-28 19:06:24 EDT,206,"Is the U.S. controlled by Israel? Is President Joe Biden helplessly beholden to the whims of Benjamin Netanyahu? In this episode of Backspace, Sana Saeed breaks down the media coverage erasing the U.S. government and Joe Biden’s role in the Gaza genocide.",https://www.facebook.com/100064529598989/posts/829623225865323
AJ+,2024-03-03 02:08:06 EST,117,Palestinian doctor Mousa al-Buhaisi served in Ukraine after Russia’s invasion and is currently saving lives in Gaza. He compares what he saw in Ukraine to the genocide in Gaza.,https://www.facebook.com/100064529598989/posts/795137662647213
The New York Times,2024-01-27 03:26:06 EST,41,"The International Court of Justice said on Friday that Israel must take action to prevent acts of genocide by its forces in the Gaza Strip. But the court did not rule on whether Israel was committing genocide, and it did not call on Israel to stop its military campaign Read more: https://nyti.ms/3u1lJ2O:=:https://www.nytimes.com/2024/01/26/world/middleeast/icj-israel-gaza-genocide.html",https://www.facebook.com/100059174186752/posts/770816684900797
AJ+,2024-01-27 14:14:48 EST,168,Palestinian journalist Bisan Owda responds to the ICJ ruling on whether Israel is committing genocide in the Gaza Strip and its decision to not order a ceasefire.,https://www.facebook.com/100064529598989/posts/773433914817588
AJ+,2024-03-23 11:08:38 EDT,126,A new campaign called No Tax for Genocide wants to hold the British government accountable for its support of Israel’s war on Gaza – by mobilizing the masses to withhold their taxes.,https://www.facebook.com/100064529598989/posts/807280378099608
NEWSMAX,2023-11-11 11:30:01 EST,46,"Anti-Israel rioters, calling for the destruction of the Jewish state and ""genocide of the Jews,"" forced the shut down of New York City's Grand Central Station on Friday night. ",https://www.facebook.com/100064878334770/posts/738730391632899
